id	source	url	observed_signal	surface_plugin_implication
vscode-cli-open-folder	VS Code command line docs	https://code.visualstudio.com/docs/configure/command-line	VS Code documents launching folders/files from the `code` CLI and using `--reuse-window` or `--new-window`.	`worktreecards` can offer copyable editor commands later, but v1 should open/reveal through AppKit/App Quick Launch rather than running editor CLIs.
github-about-readmes	GitHub Docs: About READMEs	https://docs.github.com/repositories/managing-your-repositorys-settings-and-features/customizing-your-repository/about-readmes	GitHub frames README files as the place to explain what a project does, why it is useful, what users can do with it, and how to use it.	`readmehub` should treat README files as canonical local docs and index them rather than generating replacements.
github-basic-writing	GitHub Docs: Basic writing and formatting syntax	https://docs.github.com/get-started/writing-on-github/getting-started-with-writing-and-formatting-on-github/basic-writing-and-formatting-syntax	GitHub Markdown docs cover headings, links, relative links, lists, and fenced code blocks used in repository docs.	`readmehub` can extract headings, local links, and shell command blocks without rendering or editing Markdown.
commonmark-spec	CommonMark specification	https://spec.commonmark.org/	CommonMark defines portable Markdown syntax, including ATX headings, links, and fenced code blocks.	Use a tiny deterministic extraction subset for `readmehub`; do not build a full Markdown renderer.
swift-docc	Swift-DocC documentation	https://www.swift.org/documentation/docc/	Swift-DocC builds rich documentation from Swift code comments and Markdown files.	Doc generation is a separate tooling concern; `readmehub` should link/copy docs commands only, not generate docs.
vscode-markdown	Visual Studio Code Markdown docs	https://code.visualstudio.com/docs/languages/markdown	VS Code provides Markdown editing, preview, extensions, and navigation features.	`readmehub` should open docs externally and avoid embedding a Markdown editor or preview UI.
surface-readme-plugin-system	Surface README Plugin and Block System	../README.md	Surface's README states that a block is the extension unit and lists the add-a-plugin steps through plugin target, runtime, registry, Package.swift, tests, preview fixtures, and validation commands.	`readmehub` should expose this canonical checklist and commands as read-only rows instead of creating scaffolding or a second plugin manager.
codexlog-readme-dev-loop	Codex Log README Development Loop	../plugins/codexlog/README.md	Codex Log's plugin README documents focused tests, block-preview rendering, preview smoke tests, full package checks, and fixture rules.	`readmehub` can surface plugin-specific README cards and command copy actions without running the commands.
surface-core-blockregistry	Surface Core BlockRegistry	../Sources/Core/Model.swift	`BlockRegistry` stores the active `Block` list, rejects duplicate ids at initialization, and exposes lookup by `BlockID`.	`registryhealth` should report duplicate and unknown-id issues while leaving registry enforcement in Core.
surface-blocks-registry	Surface Blocks registry	../plugins/Blocks.swift	The active registry is currently one `Blocks.registry` containing `Quicksave.Plugin.block`, `CopyHistory.Plugin.block`, and `CodexLog.Plugin.block`.	`registryhealth` should inspect/report this owner, not create a second registry or generator.
surface-package-targets	Surface SwiftPM package targets	../Package.swift	`Package.swift` explicitly wires the `Blocks` target, plugin targets, plugin tests, and `BlockPreviewTests`.	`registryhealth` can surface package/test wiring mismatches from a status report without mutating SwiftPM files.
surface-layout-default	Surface default layout	../Sources/Core/Layout.swift	`SurfaceLayout.defaultLayout` stores enabled block ids and frames for the default workspace.	`registryhealth` can report layout ids that are missing from the registry while leaving layout ownership unchanged.
surface-blockpreview-support	Surface BlockPreview support	../tools/block-preview/support/BlockPreviewSupport.swift	`BlockPreview` defines fixture coverage and renders previews through `Blocks.registry`, `Block.Context`, and the real runtime view path.	`registryhealth` should mirror fixture/render status from this owner instead of adding preview-only UI.
surface-blockpreview-tests	Surface BlockPreview tests	../tests/BlockPreviewTests/BlockPreviewTests.swift	`BlockPreviewTests` render every fixture, check nonblank PNG metrics, render the full surface, and assert current plugin fixture coverage.	`registryhealth` should display these coverage results, while tests remain the enforcement owner.
swift-package-description	Swift Package Manager PackageDescription	https://docs.swift.org/package-manager/PackageDescription/PackageDescription.html	Swift Package Manager's package description model represents packages through explicit products, targets, dependencies, and test targets.	Registry health can reason about Package.swift target wiring, but the block should not rewrite package structure.
surface-readme-add-plugin	Surface README Add a Plugin	../README.md	The README defines the canonical plugin path through `Plugin.block`, `BlockRuntime`, `Block.Context`, `plugins/Blocks.swift`, Package.swift, plugin tests, preview fixtures, and validation commands.	`plugintemplates` should present copyable checklists/snippets that follow this owner path instead of inventing a scaffolder.
surface-agents-preview-loop	Surface AGENTS plugin UI iteration loop	../AGENTS.md	AGENTS requires rendering plugin UI through the real `Block` / `BlockRuntime.makeView()` block-preview harness and says not to create preview-only UI.	Template cards should point authors to the real preview harness and fixture path.
surface-existing-plugin-shapes	Surface existing plugin source shapes	../plugins	Current plugins provide concrete examples: a small `Plugin.block`, a compact inline Copy History runtime/view, split Quicksave runtime/view/helpers, and multi-file Codex Log status/action rows.	`plugintemplates` should use these local examples rather than generating large files from scratch.
raycast-create-extension	Raycast Create Your First Extension	https://developers.raycast.com/basics/create-your-first-extension	Raycast starts extension authoring with a Create Extension command, a selected template, `npm install && npm run dev`, and edit/reload iteration.	Starter templates are useful, but Surface should keep authoring inside the existing SwiftPM/block-preview loop.
raycast-extension-templates	Raycast Templates	https://developers.raycast.com/information/developer-tools/templates	Raycast documents command, tool, and extension boilerplate templates, including detail/list/form/menu-bar/script/AI patterns and `npm init raycast-extension -t`.	`plugintemplates` can mirror pattern cards and snippets, but must not add Raycast-style generation or a template marketplace.
raycast-extension-review-checklist	Raycast Prepare an Extension for Store	https://developers.raycast.com/basics/prepare-an-extension-for-store	Raycast uses review checklists for metadata, naming, dependency lockfiles, terms, build, lint, and manual validation.	Surface plugin templates should include checklists for wiring, previews, tests, and naming without owning review automation.
vscode-first-extension	Visual Studio Code Your First Extension	https://code.visualstudio.com/api/get-started/your-first-extension	VS Code's first-extension guide uses Yeoman/generator-code to scaffold, then explains editing, debugging, and extension anatomy.	Generators validate the need for starters but are too much owner surface for Surface v1; copyable snippets/checklists are safer.
github-template-repository	GitHub template repositories	https://docs.github.com/en/repositories/creating-and-managing-repositories/creating-a-template-repository	GitHub template repositories clone an existing repository's directory structure and files into a new repository with unrelated history.	Whole-repo templates are too coarse for adding one plugin target inside Surface; avoid template-repo sync in `plugintemplates`.
apple-packagedescription-target	Apple PackageDescription Target	https://developer.apple.com/documentation/packagedescription/target	Apple documents PackageDescription targets as source-file sets that Swift Package Manager compiles into modules or test suites.	Package target wiring should remain an explicit checklist/reporting step, not a hidden template mutation.
surface-localbuildstatus-artifacts	Surface Local Build Status artifacts	../research/localbuildstatus-spec.md	`localbuildstatus` defines `.build/surface-status` as the external-runner-owned directory for build, test, preview, and combined verification JSON/log artifacts.	`diagnosticbundle` can include those existing files but should not run build/test/preview commands.
surface-registryhealth-report	Surface Registry Health report	../research/registryhealth-spec.md	`registryhealth` consumes a generated registry/package/test/fixture status report and explicitly avoids recomputing or mutating owners.	`diagnosticbundle` should bundle that report rather than duplicate registry-health logic.
surface-notificationdigest-events	Surface Notification Digest events	../research/notificationdigest-spec.md	`notificationdigest` owns Surface/plugin event summaries and excludes macOS-wide notification scraping, unified-log mining, polling services, and background daemons.	`diagnosticbundle` should include only local Surface event summaries and avoid private notification/log sources.
surface-run-script-logs	Surface run script log commands	../script/build_and_run.sh	The run script exposes interactive `--logs` and `--telemetry` paths using `/usr/bin/log stream`, plus normal run/debug/verify paths.	`diagnosticbundle` should not run `log stream`; any app log artifact must be written by an external explicit path first.
github-issue-forms	GitHub issue forms	https://docs.github.com/en/communities/using-templates-to-encourage-useful-issues-and-pull-requests/configuring-issue-templates-for-your-repository	GitHub issue forms encourage contributors to provide specific structured information through customizable form fields.	`diagnosticbundle` should copy structured issue/support Markdown but never submit or upload it.
sentry-sensitive-data-scrubbing	Sentry sensitive data scrubbing	https://docs.sentry.io/platforms/python/data-management/sensitive-data/	Sentry recommends filtering or scrubbing sensitive data before it is sent or stored by the monitoring service.	Diagnostic exports need allowlists, redaction modes, and a redaction report before any sharing.
apple-oslog-privacy	Apple OSLog privacy	https://developer.apple.com/documentation/os/oslogprivacy	Apple documents OSLog privacy options to hide potentially sensitive information in generated app logs.	Surface should not collect private unified logs by default; exported logs must be prewritten and reviewable.
apple-privacy-manifest-files	Apple Privacy Manifest files	https://developer.apple.com/documentation/bundleresources/privacy-manifest-files	Apple privacy manifests record data types collected by an app or third-party SDK and the reasons for collection.	Any future upload/telemetry diagnostic path would need separate privacy review; v1 should stay local export only.
opentelemetry-log-collection	OpenTelemetry logging	https://opentelemetry.io/docs/specs/otel/logs/	OpenTelemetry log collection includes file readers, tailing, directory watching, checkpoints, and external collectors.	`diagnosticbundle` should avoid becoming a log collector or background agent; it should copy selected existing files only.
apple-sysdiagnose	Apple Sysdiagnose training	https://it-training.apple.com/support/tutorials/course/sup270/	Apple describes sysdiagnose as extracting information and capturing it in a log file for later analysis.	Surface should not trigger or include broad sysdiagnose archives in v1 diagnostic bundles.
surface-blockpreview-output	Surface BlockPreview output	../tools/block-preview/support/BlockPreviewSupport.swift	`BlockPreview.defaultOutputDirectory` is `.build/block-previews`, `render` writes `<block>-<fixture>.png`, and `renderSurface` writes `surface-active.png`.	`previewgallery` should read these existing PNGs without invoking the renderer.
surface-blockpreview-cli	Surface block-preview CLI	../tools/block-preview/source/main.swift	The CLI lists cases, renders all/block/surface previews, and prints path, dimensions, byte count, colors, and nonbackground sample metrics.	`previewgallery` should copy these commands and display prior metrics, not run them.
surface-blockpreview-metrics	Surface BlockPreview metrics reader	../tools/block-preview/support/BlockPreviewSupport.swift	`BlockPreviewMetricsReader` reads PNG dimensions, byte count, sampled color count, and nonbackground sample count.	`previewgallery` can show metrics from existing output/index files while leaving nonblank enforcement to preview tests.
apple-nsimage-contents	Apple NSImage contentsOf URL	https://developer.apple.com/documentation/appkit/nsimage/init%28contentsof%3A%29	Apple documents initializing an image object from a local URL.	`previewgallery` can load local PNG previews directly through AppKit.
apple-imageio-thumbnail	Apple ImageIO thumbnail creation	https://developer.apple.com/documentation/imageio/cgimagesourcecreatethumbnailatindex%28_%3A_%3A_%3A%29	Apple documents creating a thumbnail image from an image source.	Use ImageIO/NSImage thumbnailing for local preview thumbnails rather than shell image tools.
apple-quicklook-thumbnailing	Apple QuickLook Thumbnailing	https://developer.apple.com/documentation/quicklookthumbnailing	Apple's QuickLook Thumbnailing framework generates thumbnails for common file types with `QLThumbnailGenerator`.	This validates local thumbnail display, but v1 can stay PNG-only.
storybook-visual-tests	Storybook visual tests	https://storybook.js.org/docs/writing-tests/visual-testing	Storybook documents visual tests as snapshots that compare rendered UI against known-good baselines.	Preview PNGs are useful UI review artifacts, but baseline comparison should stay outside `previewgallery` v1.
playwright-visual-comparisons	Playwright visual comparisons	https://playwright.dev/docs/test-snapshots	Playwright can produce screenshots and compare them with reference screenshots on subsequent runs.	Surface should avoid adding snapshot update/diff ownership to the gallery; block-preview/tests own rendering and future diff policy.
github-upload-artifact	GitHub Actions upload-artifact	https://github.com/actions/upload-artifact	GitHub's artifact action uploads generated files from workflow runs for later download.	Preview images may be artifacts, but upload/export belongs to CI or `diagnosticbundle`, not the gallery.
surface-diagnosticbundle-spec	Surface Diagnostic Bundle spec	diagnosticbundle-spec.md	`diagnosticbundle` owns explicit support export, redaction reports, and selected artifact copying.	`crashreports` should point at explicit crash files and hand off export/redaction to `diagnosticbundle`.
surface-notificationdigest-spec	Surface Notification Digest spec	notificationdigest-spec.md	`notificationdigest` owns Surface/plugin event summaries and excludes global unified-log mining.	`crashreports` should not mine logs or become an event digest.
surface-fileinbox-spec	Surface File Inbox spec	fileinbox-spec.md	`fileinbox` owns broad recent-file triage from explicit watched locations.	`crashreports` should not broadly scan DiagnosticReports folders or duplicate recent-file triage.
apple-analyzing-crash-report	Apple Xcode: Analyzing a crash report	https://developer.apple.com/documentation/xcode/analyzing-a-crash-report	Apple describes a crash report as a detailed log of an app's state when it crashed and as a resource for identifying problems.	Surface can show crash-report pointers and top fields, but root-cause diagnosis stays with Xcode/developer workflows.
apple-crash-report-fields	Apple Xcode: Examining the fields in a crash report	https://developer.apple.com/documentation/xcode/examining-the-fields-in-a-crash-report	Apple documents crash report sections such as process details, thread state, exception data, termination data, and binary images.	`crashreports` should parse only small stable metadata fields and avoid becoming a full crash-log reader.
apple-crash-json-format	Apple Xcode: Interpreting the JSON format of a crash report	https://developer.apple.com/documentation/xcode/interpreting-the-json-format-of-a-crash-report	Apple documents structured crash-report objects for OS version, bundle, exception, termination, threads, frames, and binary images.	`.ips` parsing can be structured and bounded, with frames/images collapsed or omitted by default.
apple-console-reports	Apple Support: View reports in Console on Mac	https://support.apple.com/guide/console/view-reports-cnsl664be99a/mac	Apple Console lists Crash Reports as system and user reports, with crash report names using the `.ips` extension.	Console should remain the report browser; Surface should consume explicit file pointers.
apple-acquiring-crash-reports	Apple Xcode: Acquiring crash reports and diagnostic logs	https://developer.apple.com/documentation/xcode/acquiring-crash-reports-and-diagnostic-logs	Apple documents workflows for obtaining crash reports and diagnostic logs as explicit debugging artifacts.	`crashreports` can accept explicitly obtained reports, but should not silently collect logs.
apple-metrickit-crash	MXCrashDiagnostic	https://developer.apple.com/documentation/metrickit/mxcrashdiagnostic	Apple MetricKit exposes an object representing an app crash diagnostic for apps that adopt the framework.	MetricKit is a separate app-integrated collection path and should stay out of `crashreports` v1.
surface-crashreports-symbolication-boundary	Surface Crash Reports spec	crashreports-spec.md	`crashreports` explicitly excludes running `atos`, `symbolicatecrash`, `xcrun`, `log`, or Xcode from the block runtime.	`crashsymbolication` should be a handoff/status extension inside `crashreports`, not a runner.
surface-scriptoutput-execution-owner	Surface Script Output spec	scriptoutput-spec.md	`scriptoutput` owns constrained command execution with direct executable paths, argument arrays, timeouts, and output caps.	If symbolication execution is needed later, route it to `scriptoutput` or an external producer instead of `crashreports`.
apple-symbolicate-crash-report	Apple Xcode: Adding identifiable symbol names to a crash report	https://developer.apple.com/documentation/xcode/adding-identifiable-symbol-names-to-a-crash-report	Apple says Xcode is the preferred way to symbolicate crash reports because it uses available dSYM files, while command-line symbolication is for specialized debugging situations.	Surface should copy Xcode and `atos` handoff instructions, not perform symbolication inside a block.
apple-debug-info-dsym	Apple Xcode: Building your app to include debugging information	https://developer.apple.com/documentation/xcode/building-your-app-to-include-debugging-information	Apple says distribution builds should use the Debug Information Format setting `DWARF with dSYM File` to generate necessary symbol files.	Surface can show `needs dSYM` guidance and explicit dSYM path fields, but should not generate or search for dSYMs.
apple-diagnosing-crash-reports	Apple Xcode: Diagnosing issues using crash reports and device logs	https://developer.apple.com/documentation/xcode/diagnosing-issues-using-crash-reports-and-device-logs	Apple describes crash reports as containing complete thread backtraces that show code running at the time of a crash.	`crashreports` can summarize report state, while deeper backtrace interpretation and symbolication stay with Xcode/developer tools.
surface-crashsymbolication-dsym-boundary	Surface Crash Symbolication spec	crashsymbolication-spec.md	`crashsymbolication` keeps symbolication as copied Xcode/CLI handoff text and excludes running tools, searching directories, downloading dSYMs, uploading symbols, or parsing DWARF/Mach-O.	`dsymcatalog` should be an explicit manifest read by `crashreports`, not a scanner or symbol store.
apple-crash-report-dsym-uuid	Apple Xcode: Examining the fields in a crash report	https://developer.apple.com/documentation/xcode/examining-the-fields-in-a-crash-report	Apple says the binary image UUID in a crash report is used to locate the corresponding dSYM file during symbolication.	Catalog matching should treat UUID matches as strong evidence and text-only version/build matches as possible matches.
apple-symbolicate-dwarfdump	Apple Xcode: Adding identifiable symbol names to a crash report	https://developer.apple.com/documentation/xcode/adding-identifiable-symbol-names-to-a-crash-report	Apple says developers can verify whether a binary or dSYM matches a crash report by comparing build UUIDs with `dwarfdump`, and that Xcode is the preferred symbolication path.	Surface should show UUID clues and copy handoff steps, but not run `dwarfdump` or perform symbolication.
apple-appstoreconnect-dsyms	App Store Connect: View builds and metadata	https://developer.apple.com/help/app-store-connect/manage-builds/view-builds-and-metadata/	App Store Connect documents viewing build metadata and downloading dSYM files for eligible builds, with notes about bitcode and Xcode 14 changes.	Any hosted dSYM retrieval belongs to App Store Connect/Xcode workflows or external producers, not a Surface block.
apple-xcode-download-debug-symbols	Xcode Help: Download debug symbols	https://help.apple.com/xcode/mac/current/en.lproj/devef5928039.html	Xcode Help documents downloading debug symbols in Archives organizer and inserting dSYM files into the selected archive.	Catalog rows may point at explicit archive/dSYM paths, but Xcode remains the owner of archive symbol management.
surface-gitignore-build	Surface .gitignore	../.gitignore	`.gitignore` excludes `.build/`, `dist/`, generated Xcode projects, user data, and `.DS_Store`.	Generated visual current/diff/report artifacts should remain under ignored `.build` paths.
surface-visualbaselines-retention-owner	Surface Visual Baselines spec	visualbaselines-spec.md	`visualbaselines` places current images, diff images, and `visualbaselines.json` under `.build`, while checked-in baselines live under `tests/BlockPreviewTests/Baselines`.	Retention policy should distinguish disposable generated artifacts from code-reviewed baseline fixtures.
github-actions-artifact-retention	GitHub Actions upload-artifact retention	https://github.com/actions/upload-artifact	GitHub's upload-artifact action documents a 90-day default and a `retention-days` input with a 1-to-90 day range.	CI should upload visual failure artifacts only when needed and use a short retention period such as 7 days.
github-actions-workflow-artifacts	GitHub Actions workflow artifacts	https://docs.github.com/en/actions/tutorials/store-and-share-data	GitHub Actions docs show using `retention-days` to set a custom retention period for individual workflow artifacts.	Visual baseline current/diff/report uploads should be CI-owned and per-artifact, not plugin-owned.
github-large-files	GitHub large file guidance	https://docs.github.com/en/repositories/working-with-files/managing-large-files/about-large-files-on-github	GitHub recommends repositories remain small, ideally below 1 GB, and strongly recommends staying below 5 GB.	Keep checked-in visual baselines small and measured before adding binary storage machinery.
github-lfs	GitHub Large File Storage	https://docs.github.com/repositories/working-with-files/managing-large-files/about-git-large-file-storage	GitHub documents Git LFS for large files and plan-specific maximum file sizes.	Defer LFS until baseline files approach size/churn thresholds that justify the extra setup.
git-lfs-overview	Git LFS overview	https://git-lfs.com/	Git LFS replaces large files such as graphics with text pointers in Git while storing contents on a remote server.	LFS is a storage policy for large checked-in baselines, not a runtime artifact-retention feature.
surface-package-macos-target	Surface Package.swift	../Package.swift	Surface declares a macOS 14 platform target.	Baseline platform metadata should record the supported macOS floor and the actual runner OS used for visual checks.
surface-blockpreview-screen-scale	Surface BlockPreview renderer	../tools/block-preview/support/BlockPreviewSupport.swift	`renderSurface` uses `NSScreen.main?.visibleFrame`, and `BlockImageRenderer` renders through `NSHostingView.bitmapImageRepForCachingDisplay`.	Visual baselines should record platform/scale metadata and prefer renderer determinism before adding platform lanes.
apple-high-resolution-guidelines	Apple High Resolution Guidelines for OS X	https://developer.apple.com/library/archive/documentation/GraphicsAnimation/Conceptual/HighResolutionOSX/Introduction/Introduction.html	Apple's high-resolution guidance distinguishes point-based layout from pixel backing stores and scale factors.	Baseline checks should track point size versus rendered pixel dimensions and avoid hiding scale mismatches as UI changes.
apple-nsscreen-backingscalefactor	NSScreen backingScaleFactor	https://developer.apple.com/documentation/appkit/nsscreen/backingscalefactor	Apple documents `backingScaleFactor` as the scale factor converting screen coordinates to backing store coordinates.	Record display/renderer scale in visual baseline reports before deciding whether separate scale lanes are needed.
github-actions-runners	GitHub Actions hosted runners	https://docs.github.com/en/actions/reference/runners/github-hosted-runners	GitHub documents hosted runner labels and macOS runner environments.	Visual baseline CI should pin a concrete macOS runner label instead of using `macos-latest`.
