id	source	url	observed_signal	surface_plugin_implication
github-runner-images	GitHub Actions runner images	https://github.com/actions/runner-images	GitHub's runner-images project documents available VM images and software-image updates.	Runner image changes are a source of rendering drift, so platform metadata should be captured with every baseline check.
surface-previewgallery-baseline-boundary	Surface Preview Gallery spec	previewgallery-spec.md	`previewgallery` explicitly excludes visual baselines, pixel diffs, approval workflows, and snapshot updates from v1.	Baseline comparison should live in block-preview/tests; the gallery may only read comparison artifacts later.
surface-blockpreview-baseline-owner	Surface BlockPreview owner	../tools/block-preview/support/BlockPreviewSupport.swift	`BlockPreview.renderAll` and `renderSurface` already render deterministic PNGs through real block runtimes and fixture contexts.	Visual baselines should reuse this renderer instead of adding a second preview path.
surface-blockpreview-baseline-tests	Surface BlockPreview tests	../tests/BlockPreviewTests/BlockPreviewTests.swift	`BlockPreviewTests` already render every fixture, check nonblank metrics, render the whole surface, and enforce current plugin fixture coverage.	Baseline checks should extend this enforcement owner rather than adding an overlay approval workflow.
pointfree-swift-snapshot-testing	Swift SnapshotTesting	https://github.com/pointfreeco/swift-snapshot-testing	Point-Free's SnapshotTesting stores snapshots alongside tests and captures image differences as XCTest attachments.	Swift visual baselines belong in the test harness, with explicit record modes and test artifacts.
apple-xctest-attachments	XCTest attachments	https://developer.apple.com/documentation/xctest/adding-attachments-to-tests-activities-and-issues	Apple documents attaching images, screenshots, files, folders, and strings to tests for later analysis.	Visual diff artifacts should be attached or written by tests/CI, not approved from a Surface block.
apple-thermal-state	ProcessInfo ThermalState	https://developer.apple.com/documentation/foundation/processinfo/thermalstate-swift.enum	Apple documents ProcessInfo thermal states and recommends reducing resource use when thermal state rises.	`systemhealth` can classify nominal/fair/serious/critical as user-actionable thermal status without shell polling.
apple-thermal-notification	ProcessInfo thermalStateDidChangeNotification	https://developer.apple.com/documentation/foundation/processinfo/thermalstatedidchangenotification	Apple documents a notification for thermal-state changes from ProcessInfo.	Use notification-triggered refresh instead of aggressive polling.
apple-low-power	ProcessInfo isLowPowerModeEnabled	https://developer.apple.com/documentation/foundation/processinfo/islowpowermodeenabled	Apple says apps can query whether Low Power Mode is active.	`systemhealth` can show Low Power Mode as a watch condition and suggest delaying heavy work.
apple-power-notification	NSProcessInfoPowerStateDidChange notification	https://developer.apple.com/documentation/foundation/nsnotification/name-swift.struct/nsprocessinfopowerstatedidchange	Apple documents a notification posted when device power state changes; observers should query Low Power Mode after receiving it.	Use power-state notification as a refresh trigger.
apple-disk-capacity	URLResourceValues volumeAvailableCapacityForImportantUsage	https://developer.apple.com/documentation/foundation/urlresourcevalues/volumeavailablecapacityforimportantusage	Apple exposes available capacity for important resources on the volume backing a file URL.	`systemhealth` can report low disk space via URL resource values, avoiding `df` shell parsing.
apple-nwpath-monitor	NWPathMonitor	https://developer.apple.com/documentation/network/nwpathmonitor	Apple documents NWPathMonitor as an observer for network changes.	Use Network.framework for local path status instead of pinging external hosts.
apple-nwpath-constrained	NWPath isConstrained	https://developer.apple.com/documentation/network/nwpath/isconstrained	Apple documents whether a path is constrained, such as Low Data Mode.	Surface can classify constrained network as Watch without network traffic.
apple-iopowersources	IOPowerSources.h	https://developer.apple.com/documentation/iokit/iopowersources_h	Apple says IOPowerSources provides uniform access to power-source state attached to the system.	Use IOKit for battery/power-source state when available, with no issue on desktop/no-battery machines.
raycast-quicklinks-manual	Raycast Manual: Quicklinks	https://manual.raycast.com/quicklinks	Raycast Quicklinks turn URLs, files, searches, and deeplinks into fast commands with tags and management actions.	`linkinbox` can focus on captured URL triage and quick open/copy actions instead of becoming a browser or bookmark manager.
raycast-quicklinks-autofill	Raycast Quicklinks core feature	https://www.raycast.com/core-features/quicklinks	Raycast Quicklink Auto Fill can use the active browser or clipboard, but active-browser URL/title access requires Automation permissions.	Surface `linkinbox` v1 should stay clipboard/file-backed; active browser capture belongs behind permissions/context work later.
raycast-browser-bookmarks	Raycast Browser Bookmarks	https://www.raycast.com/raycast/browser-bookmarks	Raycast Browser Bookmarks retrieves bookmarks from selected browsers/profiles and refreshes Chromium bookmarks when profile bookmark files change.	Browser bookmark search is useful, but direct browser/profile access should be an explicit later adapter, not `bookmarkcards` v1.
raycast-markmarks	Raycast MarkMarks	https://www.raycast.com/rmartins/markmarks	MarkMarks uses a Markdown file as the persistence layer for bookmarks with hierarchical groups.	This validates a file-backed bookmark shelf that Surface can preview deterministically.
chrome-bookmarks-api	Chrome Extensions Bookmarks API	https://developer.chrome.com/docs/extensions/reference/api/bookmarks	Chrome's bookmarks API lets extensions create, organize, and manipulate browser bookmarks.	Use browser bookmark APIs only through an explicit browser extension/cache path; the Swift block should not parse Chrome profile files.
mdn-webextension-bookmarks	MDN WebExtensions Bookmarks API	https://developer.mozilla.org/en-US/docs/Mozilla/Add-ons/WebExtensions/API/bookmarks	MDN documents the WebExtensions bookmarks API and notes it requires the `bookmarks` permission.	Browser bookmark access carries extension permission scope, so `bookmarkcards` v1 should stay local-file backed.
apple-safari-webextensions	Safari web extensions	https://developer.apple.com/documentation/safariservices/safari-web-extensions	Apple says Safari web extensions add functionality using JavaScript APIs and common extension formats.	A Safari bookmark adapter should be a deliberate extension/cache integration, not silent native profile access.
mozilla-bookmark-export	Firefox bookmark HTML export	https://support.mozilla.org/en-US/kb/export-firefox-bookmarks-to-backup-or-transfer	Mozilla documents exporting Firefox bookmarks to an HTML file for backup or transfer.	Exported bookmark files are a plausible explicit import source, but not a live dependency for previews or startup.
apple-internet-location	UTTypeInternetLocation	https://developer.apple.com/documentation/uniformtypeidentifiers/uttypeinternetlocation	Apple's internet-location type is identified as `com.apple.internet-location` and conforms to stored URL data.	A user-selected `.webloc` folder can be a future file-backed import source without browser profile scraping.
apple-pasteboard-url	NSPasteboard PasteboardType.url	https://developer.apple.com/documentation/appkit/nspasteboard/pasteboardtype/url	Apple documents URL data on the pasteboard and points to URL read/write pasteboard support.	Use pasteboard URL type before falling back to string scanning.
apple-urlcomponents	URLComponents	https://developer.apple.com/documentation/foundation/urlcomponents	Apple documents URLComponents as a structure for parsing URLs into and constructing URLs from components.	Use structured URL parsing for normalization and dedupe, not ad hoc string-only handling.
apple-nsworkspace-open	NSWorkspace open(_:)	https://developer.apple.com/documentation/appkit/nsworkspace/open%28_%3A%29	Apple documents opening a location at a URL through NSWorkspace.	Use for the row open action with the user's default browser/app.
raycast-quicklinks-launch	Raycast Quicklinks core feature	https://www.raycast.com/core-features/quicklinks	Raycast Quicklinks open frequently used paths, files, URLs, project folders, searches, and specific apps; Quick Search and browser autofill require Accessibility/Automation.	`appquicklaunch` should borrow curated launch cards but avoid root search, selected-text, and browser-autofill behavior in v1.
hammerspoon-application-launch	Hammerspoon hs.application	https://www.hammerspoon.org/docs/hs.application.html	Hammerspoon exposes launchOrFocus, launchOrFocusByBundleID, pathForBundleID, runningApplications, and app activation helpers.	Launcher workflows are useful, but Surface should use Swift/AppKit directly and avoid absorbing Hammerspoon or Spotlight-style search behavior.
apple-nsworkspace-openapplication	NSWorkspace openApplication(at:configuration:completionHandler:)	https://developer.apple.com/documentation/appkit/nsworkspace/openapplication%28at%3Aconfiguration%3Acompletionhandler%3A%29	Apple documents launching an application at a URL with an open configuration and completion handler.	Use for explicit app-row launch/focus actions, behind an injected adapter for tests.
apple-nsworkspace-urlforapplication	NSWorkspace urlForApplication(withBundleIdentifier:)	https://developer.apple.com/documentation/appkit/nsworkspace/urlforapplication%28withbundleidentifier%3A%29	Apple documents resolving an app URL from a bundle identifier.	Resolve curated app rows by bundle identifier before path fallback.
apple-nsrunning-runningapplications	NSRunningApplication runningApplications(withBundleIdentifier:)	https://developer.apple.com/documentation/appkit/nsrunningapplication/runningapplications%28withbundleidentifier%3A%29	Apple documents fetching running app instances for a bundle identifier.	Focus already-running apps without enumerating or indexing all installed apps.
apple-nsrunning-activate	NSRunningApplication activate(options:)	https://developer.apple.com/documentation/appkit/nsrunningapplication/activate%28options%3A%29	Apple documents activating a running application with activation options.	Use only for explicit focus actions from curated app rows.
apple-nsworkspace-open-with-app	NSWorkspace open(_:withApplicationAt:configuration:completionHandler:)	https://developer.apple.com/documentation/appkit/nsworkspace/open%28_%3Awithapplicationat%3Aconfiguration%3Acompletionhandler%3A%29	Apple documents opening URLs with a specific application URL and configuration.	Support file/folder rows with an explicit preferred app without shelling out to `open`.
apple-nsworkspace-openconfiguration	NSWorkspace.OpenConfiguration	https://developer.apple.com/documentation/appkit/nsworkspace/openconfiguration	Apple documents the configuration object used for workspace open operations.	Keep launch/open options explicit and testable instead of command-line flags.
apple-nsworkspace-reveal	NSWorkspace activateFileViewerSelecting(_:)	https://developer.apple.com/documentation/appkit/nsworkspace/activatefileviewerselecting%28_%3A%29	Apple documents revealing file URLs in the system file viewer.	Use for reveal actions on app/file/folder rows, not as a file manager replacement.
raycast-quicklinks-workspaces	Raycast Manual: Quicklinks	https://manual.raycast.com/quicklinks	Raycast Quicklinks can save a website, search URL, file path, folder, or deeplink, including project folders in an editor.	`workspacepins` should reuse curated anchors but avoid Root Search, arguments, and multi-target automation.
vscode-workspaces	Visual Studio Code: What is a workspace?	https://code.visualstudio.com/docs/editing/workspaces/workspaces	VS Code workspaces use a `.code-workspace` JSON file to group one or more folders and workspace configuration.	Workspace pins can model explicit project roots and labels without inventing a project registry.
vscode-multiroot-workspaces	Visual Studio Code: Multi-root Workspaces	https://code.visualstudio.com/docs/editing/workspaces/multi-root-workspaces	VS Code multi-root workspaces group multiple folders and keep folder-scoped launch/debug context visible.	Multiple roots are useful as explicit metadata, but Surface should not run tasks/debug configs.
apple-spaces-user-guide	Apple Support: Work in multiple spaces on Mac	https://support.apple.com/guide/mac-help/work-in-multiple-spaces-mh14112/mac	Apple documents Spaces as user-managed desktops where windows can be moved through Mission Control or edge dragging.	`workspacepins` should not switch Spaces or move windows; leave desktop arrangement user-managed or to `windowlayouts`.
hammerspoon-spaces	Hammerspoon hs.spaces	https://www.hammerspoon.org/docs/hs.spaces.html	Hammerspoon's Spaces module is experimental and relies on private APIs plus Accessibility workarounds.	Avoid Spaces control in Surface v1; private/AX-heavy session restore is outside workspace pins.
hammerspoon-expose	Hammerspoon hs.expose	https://www.hammerspoon.org/docs/hs.expose.html	Hammerspoon hs.expose creates hotkey-driven window thumbnails and switching actions.	Window switching is a separate automation/UI domain; workspace pins should show anchors, not own window navigation.
apple-linkmetadata-provider	LPMetadataProvider	https://developer.apple.com/documentation/linkpresentation/lpmetadataprovider	Apple says LPMetadataProvider fetches metadata for a URL, including title, icon, image, or video links.	Treat title/icon fetching as explicit cached network metadata later; previews and passive refresh should not fetch.
raycast-calendar	Raycast Calendar core feature	https://www.raycast.com/core-features/calendar	Raycast Calendar shows upcoming meetings, a schedule overview, join actions, attendee/email actions, and copy shortcuts, backed by the native macOS calendar setup.	`calendarprep` should focus on next-meeting prep and explicit copy/open actions, not a full calendar client.
apple-calendar-wwdc23	Apple WWDC23 Discover Calendar and EventKit	https://developer.apple.com/videos/play/wwdc2023/10052/	Apple describes EventKit as the direct calendar-data framework, explains no/write-only/full access levels, and says full access is required to fetch existing events.	`calendarprep` needs full Calendar access because it reads existing events; write-only access is not enough.
apple-calendar-fullaccess-plist	NSCalendarsFullAccessUsageDescription	https://developer.apple.com/documentation/bundleresources/information-property-list/nscalendarsfullaccessusagedescription	Apple documents the modern purpose string key for requesting full access to calendar data.	`script/build_and_run.sh` must add this key before live Calendar fetching ships.
apple-eventkit-predicate	EKEventStore predicateForEvents(withStart:end:calendars:)	https://developer.apple.com/documentation/eventkit/ekeventstore/predicateforevents%28withstart%3Aend%3Acalendars%3A%29	Apple provides an EventKit predicate for events within a date range and optional calendars.	`calendarprep` should query a short future range rather than broad calendar history.
apple-eventkit-events-matching	EKEventStore events(matching:)	https://developer.apple.com/documentation/eventkit/ekeventstore/events%28matching%3A%29	Apple's EventKit fetch API returns events matching a predicate.	`calendarprep` should sort fetched events before selecting the next meeting so previews and live UI are deterministic.
apple-ekevent	EKEvent	https://developer.apple.com/documentation/eventkit/ekevent	Apple's event object represents a calendar event with fields used for display and prep context, including title, dates, location, notes, URL, attendees, and calendar metadata.	`calendarprep` can map EventKit data to a small Codable display snapshot instead of storing raw EventKit objects.
raycast-snippets-manual	Raycast Manual: Snippets	https://manual.raycast.com/snippets	Raycast Snippets store reusable text, support keywords, tags, search/manage actions, copy/paste, imports, and dynamic placeholders.	`snippetprompt` should support a local tagged library and copy actions, but avoid global auto-expansion and typed keyword monitoring in v1.
raycast-dynamic-placeholders	Raycast Manual: Dynamic Placeholders	https://manual.raycast.com/dynamic-placeholders	Raycast placeholders include clipboard, snippet references, cursor, date/time, UUID, selected text, arguments, calculator, browser tab, modifiers, offsets, and clipboard offsets.	Surface should implement only a safe placeholder subset: date/time, clipboard on explicit action, arguments, and explicit context snapshots.
raycast-ai-commands	Raycast Manual: AI Commands	https://manual.raycast.com/ai/ai-commands	Raycast AI Commands turn prompts into one-press commands, can use selected text/placeholders, and Quick Fix needs Accessibility to read and replace active-app text.	`snippetprompt` should copy prompts/templates only; AI execution and in-place active-app replacement belong outside v1 and behind explicit permissions.
raycast-clipboard-history	Raycast Manual: Clipboard History	https://manual.raycast.com/clipboard-history	Raycast Clipboard History can search past clipboard items, copy/paste entries, save entries as snippets, pin/delete entries, and disable recording for sensitive apps.	Surface Copy History owns passive clipboard capture; `snippetprompt` may later accept a save-as-snippet handoff but should not duplicate history.
raycast-clipboard-history-settings	Raycast Manual: Clipboard History	https://manual.raycast.com/clipboard-history	Raycast Clipboard History supports retention periods, disabled applications, paste-as-plain-text, OCR, pin/delete, save-as-snippet, and Ask Clipboard actions.	Surface should borrow retention/disabled-app hygiene only; snippets, OCR, AI, and active-app paste belong to existing/later owners.
raycast-clipboard-history-control	Raycast Manual: Clipboard History Control	https://manual.raycast.com/enterprise/clipboard-history-control	Raycast Enterprise can enforce clipboard retention and disabled application bundle IDs across an organization.	Source/bundle-based exclusions are useful, but Surface v1 should use only explicit config and pasteboard source markers rather than broad app monitoring.
alfred-clipboard-advanced	Alfred Clipboard History	https://www.alfredapp.com/help/features/clipboard/	Alfred supports history duration, filtering, clipboard merging, max clip size, ignore apps, and concealed-data handling.	Copy History Rules should include max-size and concealed/transient ignore defaults, but avoid clipboard merging and active-app autopaste.
maccy-ignore-items	Maccy README	https://github.com/p0deje/Maccy	Maccy supports pausing all capture, ignoring only the next copy, ignoring confidential/temporary pasteboard marker types, and tuning polling interval.	Copy History can add pause/ignore-next and ignored pasteboard types without adding a second watcher.
keyboardmaestro-clipboard-filter	Keyboard Maestro Clipboard Filter Trigger	https://wiki.keyboardmaestro.com/trigger/Clipboard_Filter	Keyboard Maestro lets macros appear in the Clipboard History Switcher action menu and operate on the selected clipboard.	Clipboard filters are useful, but Surface should not turn rules into macro/script execution.
nspasteboard-special-types	NSPasteboard.org: transient and special clipboard data	https://nspasteboard.org/	NSPasteboard.org documents shared marker types for transient, concealed, autogenerated, source-app, proprietary password/temporary, and remote clipboard data.	Copy History should respect these markers before persisting text and never store blocked clipboard content.
apple-pasteboard-changecount	NSPasteboard changeCount	https://developer.apple.com/documentation/appkit/nspasteboard/changecount	Apple documents the pasteboard change counter used to detect pasteboard updates.	Keep the existing Copy History polling owner; do not add a second watcher for rules.
apple-pasteboard-types	NSPasteboard types	https://developer.apple.com/documentation/appkit/nspasteboard/types	Apple documents retrieving pasteboard data type identifiers.	Rules can inspect types/markers before deciding whether to persist text.
apple-pasteboard-string	NSPasteboard string(forType:)	https://developer.apple.com/documentation/appkit/nspasteboard/string%28fortype%3A%29	Apple documents reading a string representation from the pasteboard for a given type.	Keep text capture on the existing string path and evaluate rules before storage.
espanso-forms	Espanso Forms	https://espanso.org/docs/matches/forms/	Espanso forms provide input prompts that can gather variable values before rendering an expansion.	`snippetprompt` can support compact explicit argument fields without adding global text expansion.
espanso-variables	Espanso Variables	https://espanso.org/docs/matches/variables/	Espanso variables make matches dynamic and can include advanced variable types.	Surface should keep variables constrained and avoid shell/script variables in snippet placeholders.
apple-pasteboard-setstring	NSPasteboard setString(_:forType:)	https://developer.apple.com/documentation/appkit/nspasteboard/setstring%28_%3Afortype%3A%29	Apple documents writing a string value to the pasteboard for a pasteboard type.	Use the existing Copy History style of explicit pasteboard writes for copy actions rather than automatic insertion.
apple-pasteboard-clear	NSPasteboard clearContents()	https://developer.apple.com/documentation/appkit/nspasteboard/clearcontents%28%29	Apple documents clearing current pasteboard contents before adding new data.	`snippetprompt` copy actions can clear then set string content, preferably through a tiny testable adapter if factored with Copy History.
raycast-ray-boop	Raycast Ray Boop	https://www.raycast.com/nathan_schwermann/ray-boop	Ray Boop transforms selected text or clipboard text and can paste back into the document or copy to clipboard.	Surface should keep v1 to explicit input/output and copy-only; active-app paste needs permission-gated follow-up.
raycast-change-case	Raycast Change Case	https://www.raycast.com/erics118/change-case	Change Case transforms strings between case styles and documents casing behavior tradeoffs.	Case transforms are useful, but Surface should define deterministic behavior in tests rather than importing a broad transform library.
raycast-url-tools	Raycast URL Tools	https://www.raycast.com/huzef44/url-tools	URL Tools encodes or decodes clipboard URLs and overwrites clipboard contents.	URL encode/decode is a good built-in transform, but should run only from explicit input/copy actions.
raycast-paste-plain-text	Raycast Paste as Plain Text	https://www.raycast.com/koinzhang/paste-as-plain-text	Paste as Plain Text converts clipboard content to plain text, URL, or file path and pastes it.	Plain-text cleanup is useful; Surface should copy output, not paste into active apps in v1.
apple-string-transform	StringTransform	https://developer.apple.com/documentation/foundation/stringtransform	Apple StringTransform covers string transformations such as script transliteration and full-width/half-width conversion.	Use Foundation-backed transforms for slug/diacritic behavior where possible.
apple-string-applying-transform	String applyingTransform(_:reverse:)	https://developer.apple.com/documentation/swift/stringprotocol/applyingtransform%28_%3Areverse%3A%29/	Apple documents applying string transliteration transforms and returning an optional transformed string.	Slugify/transliteration should be a pure local transform with deterministic fallbacks.
apple-percent-encoding	NSString addingPercentEncoding(withAllowedCharacters:)	https://developer.apple.com/documentation/foundation/nsstring/addingpercentencoding%28withallowedcharacters%3A%29	Apple documents percent-encoding characters outside an allowed character set.	URL encoding should use structured Foundation APIs instead of ad hoc replacement.
apple-data-base64	Data base64EncodedString(options:)	https://developer.apple.com/documentation/foundation/nsdata/base64encodedstring%28options%3A%29	Apple documents creating a Base64 encoded string from data.	Base64 encode/decode can be local deterministic transform rows with visible invalid-input errors.
apple-json-serialization	JSONSerialization	https://developer.apple.com/documentation/foundation/jsonserialization	Apple JSONSerialization converts between JSON and Foundation objects.	Use JSON APIs for string escaping/validation instead of hand-built JSON escaping.
apple-nsregularexpression	NSRegularExpression	https://developer.apple.com/documentation/foundation/nsregularexpression	Apple documents immutable compiled regular expressions applied to Unicode strings.	Use fixed internal regexes for safe cleanup only; do not expose user regex pipelines in v1.
raycast-window-management	Raycast Manual: Window Management	https://manual.raycast.com/window-management	Raycast Window Management includes focused-window commands for halves, thirds, quarters, center, maximize, restore, display movement, saved layouts, custom commands, and notes that Accessibility is required on macOS.	`windowlayouts` should start with focused-window presets and explicit Accessibility-gated actions, not automatic tiling.
hammerspoon-window	Hammerspoon hs.window	https://www.hammerspoon.org/docs/hs.window.html	Hammerspoon exposes focused-window lookup plus frame, move, maximize, screen, fullscreen, and setFrame operations.	Focused-window move/resize is a proven automation shape, but Surface should implement it directly in Swift as one `BlockRuntime`.
